{"$schema":"https://json-schema.org/draft/2020-12/schema","title":"MSLO report summary","type":"object","required":["run_id","source","generated_at_utc","status","freeze_windows","bottleneck_candidates"],"properties":{"run_id":{"$ref":"common.schema.json#/$defs/runId"},"source":{"type":"string"},"generated_at_utc":{"$ref":"common.schema.json#/$defs/utcTimestamp"},"status":{"type":"string"},"freeze_windows":{"type":"array","items":{"type":"object","required":["start_utc","end_utc","start_monotonic_ms","end_monotonic_ms","duration_ms"],"properties":{"start_utc":{"$ref":"common.schema.json#/$defs/utcTimestamp"},"end_utc":{"$ref":"common.schema.json#/$defs/utcTimestamp"},"start_monotonic_ms":{"$ref":"common.schema.json#/$defs/monotonicMs"},"end_monotonic_ms":{"$ref":"common.schema.json#/$defs/monotonicMs"},"duration_ms":{"type":"number","minimum":0},"phase_name":{"type":"string"},"severity":{"$ref":"common.schema.json#/$defs/severity"},"notes":{"type":"string"}},"additionalProperties":true}},"bottleneck_candidates":{"type":"array","items":{"type":"object","required":["type","description","confidence","severity"],"properties":{"type":{"type":"string"},"description":{"type":"string"},"confidence":{"type":"number","minimum":0,"maximum":1},"severity":{"$ref":"common.schema.json#/$defs/severity"},"evidence":{"type":"array","items":{"type":"string"}}},"additionalProperties":true}},"major_gc_pause_during_freeze":{"type":"boolean"}},"additionalProperties":true}
