{
  "run_id": "sample-run-001",
  "source": "report_generator",
  "generated_at_utc": "2026-01-15T12:03:05Z",
  "status": "completed",
  "freeze_windows": [
    {
      "start_utc": "2026-01-15T12:01:00Z",
      "end_utc": "2026-01-15T12:01:30Z",
      "start_monotonic_ms": 60000,
      "end_monotonic_ms": 90000,
      "duration_ms": 30000,
      "phase_name": "client_resource_reload",
      "severity": "warning",
      "notes": "Window overlaps client resource reload while external monitor shows high disk throughput."
    }
  ],
  "bottleneck_candidates": [
    {
      "type": "disk_io_saturation",
      "description": "Disk read/write throughput was elevated during the freeze window.",
      "confidence": 0.86,
      "severity": "warning",
      "evidence": ["external.jsonl disk_read_mb_s + disk_write_mb_s >= 100 during freeze"]
    }
  ],
  "major_gc_pause_during_freeze": false
}
